### ISSUE TITLE
NetworkChaos delay adds twice latency

### ISSUE THREAD

**Issue by shardulsrivastava** [chaos-mesh/chaos-mesh#2202]
## Bug Report

**What version of Kubernetes are you using?**
```
Client Version: version.Info{Major:"1", Minor:"22", GitVersion:"v1.22.0", GitCommit:"c2b5237ccd9c0f1d600d3072634ca66cefdf272f", GitTreeState:"clean", BuildDate:"2021-08-04T17:56:19Z", GoVersion:"go1.16.6", Compiler:"gc", Platform:"darwin/amd64"}
Server Version: version.Info{Major:"1", Minor:"20+", GitVersion:"v1.20.8-gke.900", GitCommit:"28ab8501be88ea42e897ca8514d7cd0b436253d9", GitTreeState:"clean", BuildDate:"2021-06-30T09:23:36Z", GoVersion:"go1.15.13b5", Compiler:"gc", Platform:"linux/amd64"}
```

**What version of Chaos Mesh are you using?**
```
Controller manager Version: version.Info{GitVersion:"v2.0.0", GitCommit:"8055e259680adbedd728ca121b33ce2f94f72aac", BuildDate:"2021-07-23T07:27:10Z", GoVersion:"go1.15.11", Compiler:"gc", Platform:"linux/amd64"}
```

**What did you do?**
I installed ChaosMesh using helm chart and installed v2.0.0 of the application.
   ```bash
   helm upgrade \
        --install \
        chaos-mesh \
        chaos-mesh/chaos-mesh \
        -n chaos-testing \
        --create-namespace \
        --set chaosDaemon.runtime=containerd \
        --set chaosDaemon.socketPath=/run/containerd/containerd.sock \
        --version v2.0.0 \
        --wait
   ```

after installation, I created a basic Nginx service on the Kubernetes cluster.

```bash
kubectl run nginx --image=nginx --labels="app=nginx" --port=80 --expose
```
and a NetworkChaos based on the example on this [page](https://chaos-mesh.org/docs/run-a-chaos-experiment).

```yaml
apiVersion: chaos-mesh.org/v1alpha1
kind: NetworkChaos
metadata:
  name: nginx-network-delay
spec:
  action: delay
  mode: one
  selector:
    labelSelectors:
      'app': 'nginx'
  delay:
    latency: '1000ms'
  duration: '1000s'
```

after creating the experiment, I tested and response time of this service from another pod :

```bash
[ root@test-connection:/ ]$ time curl -I nginx
HTTP/1.1 200 OK
Server: nginx/1.21.1
Date: Tue, 10 Aug 2021 14:00:48 GMT
Content-Type: text/html
Content-Length: 612
Last-Modified: Tue, 06 Jul 2021 14:59:17 GMT
Connection: keep-alive
ETag: "60e46fc5-264"
Accept-Ranges: bytes

real	0m 0.02s
user	0m 0.00s
sys	0m 0.00s
[ root@test-connection:/ ]$ time curl -I nginx
HTTP/1.1 200 OK
Server: nginx/1.21.1
Date: Tue, 10 Aug 2021 14:01:14 GMT
Content-Type: text/html
Content-Length: 612
Last-Modified: Tue, 06 Jul 2021 14:59:17 GMT
Connection: keep-alive
ETag: "60e46fc5-264"
Accept-Ranges: bytes

real	0m 2.03s
user	0m 0.00s
sys	0m 0.00s
[ root@test-connection:/ ]$ 
```

**What did you expect to see?**

I expected the latency of 1 second in response.

**What did you see instead?**

I am getting twice as much latency as defined in the `delay.latency: '1000ms'`. I tried with multiple values like `2s`,`4s` and the latency I observed was `4s` and `8s`.

**Output of chaosctl**
Unable to build and run `chaosctl`.

```bash
KUBECONFIG="/Users/shardulsrivastava/Desktop/Shardul/Technical/config" ./bin/chaosctl debug networkchaos -v 10 
I0810 22:07:09.302536   40772 loader.go:375] Config loaded from file:  /Users/shardulsrivastava/Desktop/Shardul/Technical/config
E0810 22:07:09.303748   40772 root.go:78]  "msg"="failed to execute cmd" "error"="failed to create client"  "errorVerbose"="failed to create client"
```

**Comment by STRRL** [comment]
Hi @shardulsrivastava , NetworkChaos affects layer 3 in the OSI model, and HTTP works on TCP, which will send several packets when establishing connection, then send the response, so in this specific scenario you provided, the number of affected packets is not one, but two.

We could see the detail with tcpdump, look at the timestamp of the output:

```
root@not-nginx:/# tcpdump -vvv port 80 -n
tcpdump: listening on eth0, link-type EN10MB (Ethernet), capture size 262144 bytes
08:00:11.206262 IP (tos 0x0, ttl 64, id 41961, offset 0, flags [DF], proto TCP (6), length 60)
    172.17.0.7.58514 > 10.99.155.14.80: Flags [S], cksum 0x51b8 (incorrect -> 0xcc6b), seq 1502893782, win 64240, options [mss 1460,sackOK,TS val 3174751377 ecr 0,nop,wscale 7], length 0
08:00:12.206377 IP (tos 0x0, ttl 64, id 0, offset 0, flags [DF], proto TCP (6), length 60)
    10.99.155.14.80 > 172.17.0.7.58514: Flags [S.], cksum 0x51b8 (incorrect -> 0xf2fe), seq 481879318, ack 1502893783, win 65160, options [mss 1460,sackOK,TS val 1870816370 ecr 3174751377,nop,wscale 7], length 0
08:00:12.206416 IP (tos 0x0, ttl 64, id 41962, offset 0, flags [DF], proto TCP (6), length 52)
    172.17.0.7.58514 > 10.99.155.14.80: Flags [.], cksum 0x51b0 (incorrect -> 0x1a75), seq 1, ack 1, win 502, options [nop,nop,TS val 3174752378 ecr 1870816370], length 0
08:00:12.206504 IP (tos 0x0, ttl 64, id 41963, offset 0, flags [DF], proto TCP (6), length 121)
    172.17.0.7.58514 > 10.99.155.14.80: Flags [P.], cksum 0x51f5 (incorrect -> 0x9569), seq 1:70, ack 1, win 502, options [nop,nop,TS val 3174752378 ecr 1870816370], length 69: HTTP, length: 69
        GET / HTTP/1.1
        Host: nginx
        User-Agent: curl/7.64.0
        Accept: */*

08:00:13.206611 IP (tos 0x0, ttl 64, id 58244, offset 0, flags [DF], proto TCP (6), length 52)
    10.99.155.14.80 > 172.17.0.7.58514: Flags [.], cksum 0x51b0 (incorrect -> 0x1640), seq 1, ack 70, win 509, options [nop,nop,TS val 1870817371 ecr 3174752378], length 0
08:00:13.206689 IP (tos 0x0, ttl 64, id 58245, offset 0, flags [DF], proto TCP (6), length 290)
    10.99.155.14.80 > 172.17.0.7.58514: Flags [P.], cksum 0x529e (incorrect -> 0x7ba8), seq 1:239, ack 70, win 509, options [nop,nop,TS val 1870817371 ecr 3174752378], length 238: HTTP, length: 238
        HTTP/1.1 200 OK
        Server: nginx/1.21.1
        Date: Wed, 11 Aug 2021 08:00:12 GMT
        Content-Type: text/html
        Content-Length: 612
        Last-Modified: Tue, 06 Jul 2021 14:59:17 GMT
        Connection: keep-alive
        ETag: "60e46fc5-264"
        Accept-Ranges: bytes

08:00:13.206746 IP (tos 0x0, ttl 64, id 41964, offset 0, flags [DF], proto TCP (6), length 52)
    172.17.0.7.58514 > 10.99.155.14.80: Flags [.], cksum 0x51b0 (incorrect -> 0x1172), seq 70, ack 239, win 501, options [nop,nop,TS val 3174753378 ecr 1870817371], length 0
08:00:13.206975 IP (tos 0x0, ttl 64, id 58246, offset 0, flags [DF], proto TCP (6), length 664)
    10.99.155.14.80 > 172.17.0.7.58514: Flags [P.], cksum 0x5414 (incorrect -> 0x571a), seq 239:851, ack 70, win 509, options [nop,nop,TS val 1870817371 ecr 3174752378], length 612: HTTP
08:00:13.206988 IP (tos 0x0, ttl 64, id 41965, offset 0, flags [DF], proto TCP (6), length 52)
    172.17.0.7.58514 > 10.99.155.14.80: Flags [.], cksum 0x51b0 (incorrect -> 0x0f0e), seq 70, ack 851, win 501, options [nop,nop,TS val 3174753378 ecr 1870817371], length 0
08:00:13.207181 IP (tos 0x0, ttl 64, id 41966, offset 0, flags [DF], proto TCP (6), length 52)
    172.17.0.7.58514 > 10.99.155.14.80: Flags [F.], cksum 0x51b0 (incorrect -> 0x0f0d), seq 70, ack 851, win 501, options [nop,nop,TS val 3174753378 ecr 1870817371], length 0
08:00:14.207410 IP (tos 0x0, ttl 64, id 58247, offset 0, flags [DF], proto TCP (6), length 52)
    10.99.155.14.80 > 172.17.0.7.58514: Flags [F.], cksum 0x51b0 (incorrect -> 0x0b1c), seq 851, ack 71, win 509, options [nop,nop,TS val 1870818371 ecr 3174753378], length 0
08:00:14.207441 IP (tos 0x0, ttl 64, id 41967, offset 0, flags [DF], proto TCP (6), length 52)
    172.17.0.7.58514 > 10.99.155.14.80: Flags [.], cksum 0x51b0 (incorrect -> 0x073b), seq 71, ack 852, win 501, options [nop,nop,TS val 3174754379 ecr 1870818371], length 0
^C
12 packets captured
12 packets received by filter
0 packets dropped by kernel
```

**Comment by shardulsrivastava** [comment]
@STRRL thanks for the clarification, so latency is added per packet, not on the overall response.
could you please point me to docs with the details of how it works internally?

**Comment by STRRL** [comment]
I am going to close this issue because of the solved question.

Feel free to reopen it. 😄
