### ISSUE TITLE
NetworkChaos with IPVS

### ISSUE THREAD

**Issue by leoncard** [chaos-mesh/chaos-mesh#3129]
## Bug Report

**What version of Kubernetes are you using?**
1.23.4

**What version of Chaos Mesh are you using?**
2.1.4

**What did you do?**

Chaos Mesh was installed with
helm upgrade --install chaos-mesh chaos-mesh/chaos-mesh --version 2.1.4 --namespace chaos-testing --set dashboard.create=true --set dashboard.securityMode=false --set dnsServer.create=true --set chaosDaemon.env.DOCKER_API_VERSION=1.39

We created a `Loss` Network Attack between 2 services, and set the direction to `both` .

When ipvs is enabled the test does nothing, if we switch to ip tables the test starts working actually blocking the connections.

To test we did a curl from one pod to the other (in our case, from the busybox pod to the myapp pod).

On the dashboard it shows  `Successfully apply chaos`   for the pods we would like it applied for both iptables and ipvs.

So there is no error output, we also saw on the chaos daemon logs that it was trying to apply some ip tables rules even if the cluster was running with ipvs.

The NetworkChaos schedule we are running is as follows

```
kind: Schedule
apiVersion: chaos-mesh.org/v1alpha1
metadata:
  namespace: testbed
  name: myapp-buysbox-networkchaos-loss-both
  annotations:
    experiment.chaos-mesh.org/pause: 'false'
spec:
  schedule: '* * * * *'
  startingDeadlineSeconds: null
  concurrencyPolicy: Allow
  historyLimit: 1
  type: NetworkChaos
  networkChaos:
    selector:
      namespaces:
        - testbed
      labelSelectors:
        app: busybox
    mode: all
    action: loss
    duration: 2m
    loss:
      loss: '100'
      correlation: '100'
    direction: both
    target:
      selector:
        namespaces:
          - testbed
        labelSelectors:
          app: myapp
      mode: all
```

**What did you expect to see?**

We were expecting the NetworkChaos experiment to have blocked the connections when the cluster was running with ipvs.

**What did you see instead?**

The NetworkChaos experiments only worked when the cluster was running with iptables.

**Comment by YangKeao** [comment]
AIK the ipvs shouldn't affect the connection between two pods, so I have two more things to confirm:

1. Will this configuration work without "target"? For example:
   ```yaml
kind: Schedule
apiVersion: chaos-mesh.org/v1alpha1
metadata:
  namespace: testbed
  name: myapp-buysbox-networkchaos-loss-both
  annotations:
    experiment.chaos-mesh.org/pause: 'false'
spec:
  schedule: '* * * * *'
  startingDeadlineSeconds: null
  concurrencyPolicy: Allow
  historyLimit: 1
  type: NetworkChaos
  networkChaos:
    selector:
      namespaces:
        - testbed
      labelSelectors:
        app: busybox
    mode: all
    action: loss
    duration: 2m
    loss:
      loss: '100'
      correlation: '100'
    direction: both
   ```
   Without the `target`, the `loss` don't need iptables to match the ipset and filter the packets.

2. I guess the target is somehow `DNAT`ed, and the filter table cannot see the correct target ip. I don't know why the target will be `DNAT`ed. Could you use `tcpdump` or something to track the target ip of the pod?

**Comment by leoncard** [comment]
Hello, thanks for replying. That does work with direction `to`, which is good :) but it blocks all connections for busybox.

Is there a way to block the connections for a particular application like what we were trying to do before with busybox and myapp?

# Tcpdump output

Thats the output we have when trying to run **with** the target block

```
10:29:00.289292 ARP, Request who-has 10-244-8-245.chaos-daemon.chaos-testing.svc.cluster.local tell 10.244.8.1, length 28
10:29:00.314299 ARP, Request who-has 10.244.8.1 tell busybox-79ccdddf4d-vfdx5, length 28
10:29:00.314324 ARP, Request who-has 10.244.8.1 tell busybox-79ccdddf4d-vfdx5, length 28
10:29:00.314450 ARP, Reply 10.244.8.1 is-at 26:65:56:b5:5b:67 (oui Unknown), length 28
10:29:00.314597 IP busybox-79ccdddf4d-vfdx5.50465 > 169.254.20.10.53: 17612+ PTR? 245.8.244.10.in-addr.arpa. (43)
10:29:00.316320 IP 169.254.20.10.53 > busybox-79ccdddf4d-vfdx5.50465: 17612*- 1/0/0 PTR 10-244-8-245.chaos-daemon.chaos-testing.svc.cluster.local. (139)
10:29:05.531051 ARP, Request who-has busybox-79ccdddf4d-vfdx5 tell 10.244.8.1, length 28
10:29:05.531136 ARP, Reply busybox-79ccdddf4d-vfdx5 is-at 46:cc:4e:69:57:69 (oui Unknown), length 28
10:29:08.293160 IP busybox-79ccdddf4d-vfdx5.36416 > 169.254.20.10.53: 57413+ A? myapp.integration.svc.cluster.local. (55)
10:29:08.293202 IP busybox-79ccdddf4d-vfdx5.36416 > 169.254.20.10.53: 57913+ AAAA? myapp.integration.svc.cluster.local. (55)
10:29:08.294225 IP 169.254.20.10.53 > busybox-79ccdddf4d-vfdx5.36416: 57913*- 0/1/0 (148)
10:29:08.294406 IP 169.254.20.10.53 > busybox-79ccdddf4d-vfdx5.36416: 57413*- 1/0/0 A 10.102.3.88 (108)
10:29:08.294521 IP busybox-79ccdddf4d-vfdx5.39566 > myapp.integration.svc.cluster.local.80: Flags [S], seq 137227401, win 64860, options [mss 1410,sackOK,TS val 1804536206 ecr 0,nop,wscale 7], length 0
10:29:08.299161 IP myapp.integration.svc.cluster.local.80 > busybox-79ccdddf4d-vfdx5.39566: Flags [S.], seq 771108334, ack 137227402, win 64308, options [mss 1410,sackOK,TS val 1576913367 ecr 1804536206,nop,wscale 7], length 0
10:29:08.299192 IP busybox-79ccdddf4d-vfdx5.39566 > myapp.integration.svc.cluster.local.80: Flags [.], ack 1, win 507, options [nop,nop,TS val 1804536210 ecr 1576913367], length 0
10:29:08.299262 IP busybox-79ccdddf4d-vfdx5.39566 > myapp.integration.svc.cluster.local.80: Flags [P.], seq 1:80, ack 1, win 507, options [nop,nop,TS val 1804536210 ecr 1576913367], length 79: HTTP: GET /myhealth HTTP/1.1
10:29:08.299411 IP myapp.integration.svc.cluster.local.80 > busybox-79ccdddf4d-vfdx5.39566: Flags [.], ack 80, win 502, options [nop,nop,TS val 1576913372 ecr 1804536210], length 0
10:29:08.302676 IP myapp.integration.svc.cluster.local.80 > busybox-79ccdddf4d-vfdx5.39566: Flags [P.], seq 1:231, ack 80, win 502, options [nop,nop,TS val 1576913375 ecr 1804536210], length 230: HTTP: HTTP/1.1 200 OK
10:29:08.302693 IP busybox-79ccdddf4d-vfdx5.39566 > myapp.integration.svc.cluster.local.80: Flags [.], ack 231, win 506, options [nop,nop,TS val 1804536214 ecr 1576913375], length 0
10:29:08.303044 IP busybox-79ccdddf4d-vfdx5.39566 > myapp.integration.svc.cluster.local.80: Flags [F.], seq 80, ack 231, win 506, options [nop,nop,TS val 1804536214 ecr 1576913375], length 0
10:29:08.303622 IP myapp.integration.svc.cluster.local.80 > busybox-79ccdddf4d-vfdx5.39566: Flags [F.], seq 231, ack 81, win 502, options [nop,nop,TS val 1576913376 ecr 1804536214], length 0
10:29:08.303634 IP busybox-79ccdddf4d-vfdx5.39566 > myapp.integration.svc.cluster.local.80: Flags [.], ack 232, win 506, options [nop,nop,TS val 1804536215 ecr 1576913376], length 0
```

And thats the tcpdump output **without**  the target block.

```
10:40:03.454187 ARP, Request who-has busybox-79ccdddf4d-vfdx5 tell 10.244.8.1, length 28
10:40:04.474196 ARP, Request who-has busybox-79ccdddf4d-vfdx5 tell 10.244.8.1, length 28
10:40:05.502202 ARP, Request who-has busybox-79ccdddf4d-vfdx5 tell 10.244.8.1, length 28

```

How can we do the same test but between two specific applications?

> AIK the ipvs shouldn't affect the connection between two pods, so I have two more things to confirm:
> 
> 1. Will this configuration work without "target"? For example:
> 
> ```yaml
> kind: Schedule
> apiVersion: chaos-mesh.org/v1alpha1
> metadata:
>   namespace: testbed
>   name: myapp-buysbox-networkchaos-loss-both
>   annotations:
>     experiment.chaos-mesh.org/pause: 'false'
> spec:
>   schedule: '* * * * *'
>   startingDeadlineSeconds: null
>   concurrencyPolicy: Allow
>   historyLimit: 1
>   type: NetworkChaos
>   networkChaos:
>     selector:
>       namespaces:
>         - testbed
>       labelSelectors:
>         app: busybox
>     mode: all
>     action: loss
>     duration: 2m
>     loss:
>       loss: '100'
>       correlation: '100'
>     direction: both
> ```
> 
> Without the `target`, the `loss` don't need iptables to match the ipset and filter the packets.
> 
> 2. I guess the target is somehow `DNAT`ed, and the filter table cannot see the correct target ip. I don't know why the target will be `DNAT`ed. Could you use `tcpdump` or something to track the target ip of the pod?

**Comment by YangKeao** [comment]
@leoncard How did the `busybox` connect to `myapp`? According to the `tcpdump`, it seems that the `busybox` is connecting `myapp` through service? The `NetworkChaos` will only have effect for `POD-POD` connection (when specified the target). Considering this, it's quite surprising that it will work under iptables mode 😮 .

I believe setting `target` to a service is on our roadmap (@STRRL right?), but don't know when we will have time to design and implement it 😢 A temporary solution is to write `myapp.integration.svc.cluster.local` in the `externalTargets`, it will automatically resolve the domain and insert the related rules into the selected pods.

**Comment by leoncard** [comment]
Hello, sorry about the late response, I've been dragged into other work and couldn't come back to it.

So, we did test the suggested address `myapp.integration.svc.cluster.local` . 
Unfortunately it didn't work for us either.
I believe its something on our Kubernetes cluster configuration but we were not able to find exactly what is causing it.

We have 2 other Kubernetes clusters and the Network Chaos with a target works just fine on them.

The `myapp` service has ClusterIP type on all clusters.

When doing a tcpdump on the clusters where Network Chaos is working we noticed that when we do a request from a `busybox` pod to a `myapp` pod, the ip address that comes in the request to `myapp` is the `busybox` ip address. So, the iptables rule that chaos mesh injects in the `myapp` pods works there. However, when doing the same test in the cluster that doesn't work, instead of getting the busybox pod IP address we get the `cni0` ip address of the node where `myapp` is running. (We're running flannel in all clusters).

We tried HTTP Chaos as well passing the `myapp` service host header and its able to block the connections on all clusters, which doesn't happen for Network Chaos.

I have slightly modified the Network Chaos test with direction `to` instead of `both`.

```
kind: Schedule
apiVersion: chaos-mesh.org/v1alpha1
metadata:
  namespace: testbed
  name: busybox-loss-to-myapp
  annotations:
    experiment.chaos-mesh.org/pause: 'true'
spec:
  schedule: '* * * * *'
  startingDeadlineSeconds: null
  concurrencyPolicy: Forbid
  historyLimit: 1
  type: NetworkChaos
  networkChaos:
    selector:
      namespaces:
        - testbed
      labelSelectors:
        app: myapp
    mode: all
    action: loss
    duration: 10m
    loss:
      loss: '100'
      correlation: '100'
    direction: to
    target:
      selector:
        namespaces:
          - testbed
        labelSelectors:
          app: busybox
      mode: all
```

And thats the HTTP Fault

```
kind: Schedule
apiVersion: chaos-mesh.org/v1alpha1
metadata:
  namespace: testbed
  name: myapp-buysbox-httpchaos
spec:
  schedule: '* * * * *'
  startingDeadlineSeconds: 10
  concurrencyPolicy: Forbid
  historyLimit: 1
  type: HTTPChaos
  httpChaos:
    selector:
      namespaces:
        - testbed
      labelSelectors:
        app: busybox
    mode: all
    target: Request
    abort: true
    port: 80
    path: '*'
    request_headers:
      Host: myapp
    duration: 2m
```
