### ISSUE TITLE
HTTPChaos patch response not worked as expected, HTTP Header content-length is not updated

### ISSUE THREAD

**Issue by STRRL** [chaos-mesh/chaos-mesh#2152]
## Bug Report

**What version of Kubernetes are you using?**

```
Client Version: version.Info{Major:"1", Minor:"21", GitVersion:"v1.21.3", GitCommit:"ca643a4d1f7bfe34773c74f79527be4afd95bf39", GitTreeState:"clean", BuildDate:"2021-07-15T21:04:39Z", GoVersion:"go1.16.6", Compiler:"gc", Platform:"linux/amd64"}
Server Version: version.Info{Major:"1", Minor:"21", GitVersion:"v1.21.2", GitCommit:"092fbfbf53427de67cac1e9fa54aaa09a28371d7", GitTreeState:"clean", BuildDate:"2021-06-16T12:53:14Z", GoVersion:"go1.16.5", Compiler:"gc", Platform:"linux/amd64"}

minikube version: v1.22.0
commit: a03fbcf166e6f74ef224d4a63be4277d017bb62e
```
**What version of Chaos Mesh are you using?**

```
Controller manager Version: version.Info{GitVersion:"v2.0.0", GitCommit:"8055e259680adbedd728ca121b33ce2f94f72aac", BuildDate:"2021-07-23T07:27:10Z", GoVersion:"go1.15.11", Compiler:"gc", Platform:"linux/amd64"}
```

**What did you do?**

my workload and httpchaos is here:

```yaml
---
apiVersion: v1
kind: ConfigMap
metadata:
  name: nginx-index-html
data:
  index.html: |
    {"hello":"world"}
---
apiVersion: apps/v1
kind: Deployment
metadata:
  labels:
    app: nginx
  name: nginx
spec:
  replicas: 3
  selector:
    matchLabels:
      app: nginx
  template:
    metadata:
      labels:
        app: nginx
    spec:
      volumes:
        - name: nginx-index-html
          configMap:
            name: nginx-index-html
      containers:
      - image: nginx:latest
        name: nginx
        resources: {}
        volumeMounts:
          - mountPath: /usr/share/nginx/html/index.html
            name: nginx-index-html
            subPath: index.html
```

```yaml
apiVersion: chaos-mesh.org/v1alpha1
kind: HTTPChaos
metadata:
  name: http-chaos-example
spec:
  mode: all
  port: 80
  selector:
    labelSelectors:
      "app": "nginx"
  target: Response
  patch:
    body: 
      type: "JSON"
      value: '{"hello": "chaos mesh"}'
```

apply them into kubernetes, 

then `kubectl port-forward <one-of-the-nginx-pod> 8080:80` .

**What did you expect to see?**

`curl localhost:8080` show me `{"hello": "chaos mesh"}`

**What did you see instead?**

```
$ curl localhost:8080
{"hello":"chaos me%    
```

output of tcpdump 
```
❯ sudo tcpdump -vvv port 8080 -i lo
dropped privs to tcpdump
tcpdump: listening on lo, link-type EN10MB (Ethernet), snapshot length 262144 bytes
20:24:17.621668 IP6 (flowlabel 0x6f2dc, hlim 64, next-header TCP (6) payload length: 40) localhost.55096 > localhost.webcache: Flags [S], cksum 0x0030 (incorrect -> 0x99f0), seq 2754515281, win 65476, options [mss 65476,sackOK,TS val 2200634564 ecr 0,nop,wscale 7], length 0
20:24:17.621690 IP6 (flowlabel 0xf4d70, hlim 64, next-header TCP (6) payload length: 40) localhost.webcache > localhost.55096: Flags [S.], cksum 0x0030 (incorrect -> 0x3ec5), seq 3107920375, ack 2754515282, win 65464, options [mss 65476,sackOK,TS val 2200634564 ecr 2200634564,nop,wscale 7], length 0
20:24:17.621700 IP6 (flowlabel 0x6f2dc, hlim 64, next-header TCP (6) payload length: 32) localhost.55096 > localhost.webcache: Flags [.], cksum 0x0028 (incorrect -> 0x655b), seq 1, ack 1, win 512, options [nop,nop,TS val 2200634564 ecr 2200634564], length 0
20:24:17.621761 IP6 (flowlabel 0x6f2dc, hlim 64, next-header TCP (6) payload length: 110) localhost.55096 > localhost.webcache: Flags [P.], cksum 0x0076 (incorrect -> 0xbcb4), seq 1:79, ack 1, win 512, options [nop,nop,TS val 2200634564 ecr 2200634564], length 78: HTTP, length: 78
        GET / HTTP/1.1
        Host: localhost:8080
        User-Agent: curl/7.76.1
        Accept: */*

20:24:17.621767 IP6 (flowlabel 0xf4d70, hlim 64, next-header TCP (6) payload length: 32) localhost.webcache > localhost.55096: Flags [.], cksum 0x0028 (incorrect -> 0x650e), seq 1, ack 79, win 511, options [nop,nop,TS val 2200634564 ecr 2200634564], length 0
20:24:17.627666 IP6 (flowlabel 0xf4d70, hlim 64, next-header TCP (6) payload length: 290) localhost.webcache > localhost.55096: Flags [P.], cksum 0x012a (incorrect -> 0x20d7), seq 1:259, ack 79, win 512, options [nop,nop,TS val 2200634570 ecr 2200634564], length 258: HTTP, length: 258
        HTTP/1.1 200 OK
        server: nginx/1.21.1
        date: Mon, 26 Jul 2021 12:24:17 GMT
        content-type: text/html
        content-length: 18
        last-modified: Mon, 26 Jul 2021 11:55:35 GMT
        connection: keep-alive
        etag: "60fea2b7-12"
        accept-ranges: bytes

        {"hello":"chaos mesh"} [|http]
20:24:17.627679 IP6 (flowlabel 0x6f2dc, hlim 64, next-header TCP (6) payload length: 32) localhost.55096 > localhost.webcache: Flags [.], cksum 0x0028 (incorrect -> 0x6401), seq 79, ack 259, win 510, options [nop,nop,TS val 2200634570 ecr 2200634570], length 0
20:24:17.627754 IP6 (flowlabel 0x6f2dc, hlim 64, next-header TCP (6) payload length: 32) localhost.55096 > localhost.webcache: Flags [F.], cksum 0x0028 (incorrect -> 0x63fe), seq 79, ack 259, win 512, options [nop,nop,TS val 2200634570 ecr 2200634570], length 0
20:24:17.628741 IP6 (flowlabel 0xf4d70, hlim 64, next-header TCP (6) payload length: 32) localhost.webcache > localhost.55096: Flags [F.], cksum 0x0028 (incorrect -> 0x63fc), seq 259, ack 80, win 512, options [nop,nop,TS val 2200634571 ecr 2200634570], length 0
20:24:17.628756 IP6 (flowlabel 0x6f2dc, hlim 64, next-header TCP (6) payload length: 32) localhost.55096 > localhost.webcache: Flags [.], cksum 0x0028 (incorrect -> 0x63fb), seq 80, ack 260, win 512, options [nop,nop,TS val 2200634571 ecr 2200634571], length 0
^C
10 packets captured
20 packets received by filter
0 packets dropped by kernel

```

If the patched body is **larger** than the original one, the body is just stripped.

If the patched body is **smaller** than the original one, some HTTP client (for example, curl) will hang up forever.

**Comment by STRRL** [comment]
PTAL @Hexilee @Andrewmatilde

**Comment by Hexilee** [comment]
Thx, I think it's a bug as users cannot infer the exact length of the patched body.
